{"$id":"opensocrates.project-memory.response/1.0.0","$schema":"https://json-schema.org/draft/2020-12/schema","additionalProperties":false,"properties":{"limitations":{"items":{"maxLength":1024,"type":"string"},"maxItems":32,"type":"array"},"request_id":{"pattern":"^[0-9a-fA-F]{8}-[0-9a-fA-F]{4}-[1-8][0-9a-fA-F]{3}-[89abAB][0-9a-fA-F]{3}-[0-9a-fA-F]{12}$","type":["string","null"]},"result":{},"retryable":{"type":"boolean"},"schema":{"const":"opensocrates.project-memory.response/1.0.0"},"status":{"enum":["ok","disabled","needs_refresh","partial","conflict","budget_insufficient","busy","unavailable","invalid_request"]}},"required":["schema","request_id","status","result","limitations","retryable"],"title":"project-memory-response","type":"object"}
