{
  "limitations": [],
  "request_id": "007ed09b-dc8a-4283-a7ca-e2df3474304f",
  "result": [
    {
      "conflict_ids": [],
      "created_at": "2026-09-26T16:41:00Z",
      "freshness": "unknown",
      "kind": "decision",
      "lifecycle": "accepted",
      "origin": {
        "attestation": "operator_declared",
        "producer_kind": "agent",
        "source_reference": "fixture:practical-user-intent"
      },
      "payload": null,
      "project_id": "d7899b1a-e605-4960-96dd-be908bc131cb",
      "rationale": null,
      "record_id": "14cfc324-1825-4414-9838-5860dc1a4038",
      "revalidation": {
        "dependency_paths": [],
        "negative_claim": false,
        "on_change": "not_applicable"
      },
      "schema": "opensocrates.project-memory.record/1.0.0",
      "scope": {
        "level": "project"
      },
      "snapshot_id": null,
      "source_refs": [],
      "summary": "Plan for 48 attendees; step-free access is required; the budget ceiling is 7000; no booking is authorized.",
      "supersedes": null,
      "support": "agent_reported",
      "updated_at": "2026-09-26T16:41:00Z",
      "version": 2
    },
    {
      "conflict_ids": [],
      "created_at": "2026-09-26T16:41:01Z",
      "freshness": "unknown",
      "kind": "checkpoint",
      "lifecycle": "proposed",
      "origin": {
        "attestation": "agent_reported",
        "producer_kind": "agent",
        "source_reference": null
      },
      "payload": {
        "blockers": [],
        "checkpoint_version": 1,
        "completed_actions": [],
        "completion_conditions": [
          "Plan matches current capacity."
        ],
        "conflict_ids": [],
        "constraints": [
          "No booking."
        ],
        "decision_refs": [],
        "next_action": "Read current source and replace any obsolete shortlist.",
        "objective": "Continue the accessible event plan.",
        "parent_checkpoint_id": null,
        "pending_effects": [],
        "remaining_actions": [],
        "snapshot_id": null,
        "source_refs": []
      },
      "project_id": "d7899b1a-e605-4960-96dd-be908bc131cb",
      "rationale": null,
      "record_id": "96f1af66-5760-4e6b-a861-69dbe576e09a",
      "revalidation": {
        "dependency_paths": [],
        "negative_claim": false,
        "on_change": "refresh_or_mark_stale"
      },
      "schema": "opensocrates.project-memory.record/1.0.0",
      "scope": {
        "level": "task",
        "task_id": "20fa18fa-0da9-44cb-9db7-441428d8d819",
        "workspace_id": "f18ed69d-e0fb-4553-8571-afcaa745b96c"
      },
      "snapshot_id": null,
      "source_refs": [],
      "summary": "Continue the accessible event plan.",
      "supersedes": null,
      "support": "agent_reported",
      "updated_at": "2026-09-26T16:41:01Z",
      "version": 1
    }
  ],
  "retryable": false,
  "schema": "opensocrates.project-memory.response/1.0.0",
  "status": "ok"
}
